{
  "$schema": "http://json-schema.org/draft-07/schema#",
  "$id": "https://loom.dev/schemas/test-output.schema.json",
  "title": "Test Output Schema",
  "description": "Standardized schema for test execution results across repositories",
  "type": "object",
  "required": ["success", "summary", "timestamp", "duration", "environment"],
  "properties": {
    "success": {
      "type": "boolean",
      "description": "Overall test suite success status"
    },
    "summary": {
      "type": "object",
      "description": "High-level test execution summary",
      "required": ["total", "passed", "failed", "skipped", "errors"],
      "properties": {
        "total": {
          "type": "integer",
          "minimum": 0,
          "description": "Total number of tests"
        },
        "passed": {
          "type": "integer",
          "minimum": 0,
          "description": "Number of tests that passed"
        },
        "failed": {
          "type": "integer",
          "minimum": 0,
          "description": "Number of tests that failed"
        },
        "skipped": {
          "type": "integer",
          "minimum": 0,
          "description": "Number of tests that were skipped"
        },
        "errors": {
          "type": "integer",
          "minimum": 0,
          "description": "Number of tests that had errors (different from failures)"
        }
      },
      "additionalProperties": false
    },
    "coverage": {
      "type": "object",
      "description": "Code coverage metrics (optional)",
      "properties": {
        "percentage": {
          "type": "number",
          "minimum": 0,
          "maximum": 100,
          "description": "Overall coverage percentage"
        },
        "lines": {
          "type": "object",
          "properties": {
            "covered": {"type": "integer", "minimum": 0},
            "total": {"type": "integer", "minimum": 0},
            "missing": {"type": "integer", "minimum": 0}
          }
        },
        "branches": {
          "type": "object",
          "properties": {
            "covered": {"type": "integer", "minimum": 0},
            "total": {"type": "integer", "minimum": 0},
            "missing": {"type": "integer", "minimum": 0}
          }
        },
        "files": {
          "type": "array",
          "description": "Per-file coverage information",
          "items": {
            "type": "object",
            "required": ["path", "percentage"],
            "properties": {
              "path": {"type": "string"},
              "percentage": {"type": "number", "minimum": 0, "maximum": 100},
              "lines_covered": {"type": "integer", "minimum": 0},
              "lines_total": {"type": "integer", "minimum": 0}
            }
          }
        }
      }
    },
    "duration": {
      "type": "number",
      "description": "Total test execution time in seconds",
      "minimum": 0
    },
    "timestamp": {
      "type": "string",
      "format": "date-time",
      "description": "ISO 8601 timestamp when tests were executed"
    },
    "environment": {
      "type": "object",
      "description": "Test execution environment information",
      "required": ["python_version", "platform", "runner"],
      "properties": {
        "python_version": {
          "type": "string",
          "description": "Python version used"
        },
        "platform": {
          "type": "string",
          "description": "Operating system platform"
        },
        "runner": {
          "type": "string",
          "description": "Test runner used (e.g., pytest, unittest)"
        },
        "runner_version": {
          "type": "string",
          "description": "Version of the test runner"
        },
        "ci": {
          "type": "boolean",
          "description": "Whether tests were run in CI environment"
        },
        "ci_provider": {
          "type": "string",
          "description": "CI provider name if applicable"
        }
      }
    },
    "repository": {
      "type": "object",
      "description": "Repository information",
      "properties": {
        "name": {
          "type": "string",
          "description": "Repository name"
        },
        "path": {
          "type": "string",
          "description": "Repository path"
        },
        "commit": {
          "type": "string",
          "description": "Git commit SHA"
        },
        "branch": {
          "type": "string",
          "description": "Git branch name"
        },
        "dirty": {
          "type": "boolean",
          "description": "Whether repository has uncommitted changes"
        }
      }
    },
    "failures": {
      "type": "array",
      "description": "Details of failed tests",
      "items": {
        "type": "object",
        "required": ["test_id", "message"],
        "properties": {
          "test_id": {
            "type": "string",
            "description": "Unique test identifier (e.g., module::class::method)"
          },
          "name": {
            "type": "string",
            "description": "Human-readable test name"
          },
          "file": {
            "type": "string",
            "description": "Test file path"
          },
          "line": {
            "type": "integer",
            "description": "Line number where test is defined"
          },
          "message": {
            "type": "string",
            "description": "Failure message"
          },
          "type": {
            "type": "string",
            "description": "Failure type (assertion, error, timeout, etc.)"
          },
          "traceback": {
            "type": "string",
            "description": "Full traceback if available"
          },
          "duration": {
            "type": "number",
            "description": "Test execution time in seconds"
          }
        }
      }
    },
    "errors": {
      "type": "array",
      "description": "Details of test errors (setup/teardown failures)",
      "items": {
        "$ref": "#/properties/failures/items"
      }
    },
    "skipped": {
      "type": "array",
      "description": "Details of skipped tests",
      "items": {
        "type": "object",
        "required": ["test_id", "reason"],
        "properties": {
          "test_id": {
            "type": "string",
            "description": "Unique test identifier"
          },
          "name": {
            "type": "string",
            "description": "Human-readable test name"
          },
          "reason": {
            "type": "string",
            "description": "Reason for skipping"
          }
        }
      }
    },
    "warnings": {
      "type": "array",
      "description": "Test warnings (deprecations, etc.)",
      "items": {
        "type": "object",
        "properties": {
          "category": {
            "type": "string",
            "description": "Warning category"
          },
          "message": {
            "type": "string",
            "description": "Warning message"
          },
          "file": {
            "type": "string",
            "description": "File where warning occurred"
          },
          "line": {
            "type": "integer",
            "description": "Line number"
          }
        }
      }
    },
    "metadata": {
      "type": "object",
      "description": "Additional metadata",
      "properties": {
        "tags": {
          "type": "array",
          "items": {"type": "string"}
        },
        "markers": {
          "type": "array",
          "items": {"type": "string"},
          "description": "Test markers/labels used"
        },
        "config_file": {
          "type": "string",
          "description": "Test configuration file used"
        },
        "test_paths": {
          "type": "array",
          "items": {"type": "string"},
          "description": "Paths where tests were discovered"
        },
        "plugins": {
          "type": "array",
          "items": {"type": "string"},
          "description": "Test plugins active"
        }
      }
    }
  },
  "additionalProperties": false
}